<?xml version='1.0' encoding='ISO-8859-1' ?>
<!DOCTYPE requirement SYSTEM "requirement.dtd">

<requirement id='engine.qos.destination.offline' type='NEW' prio='LOW' status="CLOSED">
   <topic>If the receiver of a PtP message is offline or has no callback, the sender gets an exception</topic>
   <description>
      If you send a message to a named destination, using the qos &lt;destination&lt; tag,
      and there is no callback for this receiver, or the receiver is not logged in
      and the &lt;ForceUpdate&lt; qos tag is not set in this message, you get a
      XmlBlasterException.
   </description>
   <see>engine.qos.publish.ForceQueuing</see>
   <author>ruff@swand.lake.de</author>
   <date>2000 03 17</date>
   <revision>$Revision: 1.1 $</revision>
   <fix status="CLOSED">
      <name>-</name>
      <comment>-</comment>
      <test tool="SUITE">testsuite.org.xmlBlaster.TestPtDQueue</test>
   </fix>
</requirement>

