<?xml version='1.0' encoding='ISO-8859-1' ?>
<!DOCTYPE requirement SYSTEM "requirement.dtd">

<requirement id='util.property' type='NEW' prio='LOW' status="CLOSED">
   <topic>XmlBlaster provides a property file to allow a simple configuration</topic>
   <description>
      The xmlBlaster.properties file allows to customize the behavior of xmlBlaster.
      It is searched in the following locations:
      &lt;ol>
      &lt;li>In $HOME&lt;/li>
      &lt;li>In $XMLBLASTER_HOME&lt;/li>
      &lt;li>Local directory&lt;/li>
      &lt;li>Fallback: \xmlBlaster oder /usr/local/xmlBlaster&lt;/li>
      &lt;/ol>
   </description>
   <author>ruff@swand.lake.de</author>
   <date>2000 02 24</date>
   <revision>$Revision: 1.3 $</revision>
   <testcase status="CLOSED">
      <name>ruff@swand.lake.de</name>
      <comment>
      The property file is used everywhere in the xmlBlaster code.
      The modules test their property variables in their own test cases.
      </comment>
      <test tool="SUITE">testsuite.org.xmlBlaster.TestAll</test>
   </testcase>
</requirement>

