<?xml version='1.0' encoding='ISO-8859-1' ?>
<!DOCTYPE requirement SYSTEM "requirement.dtd">

<requirement id='util.recorder.returnvalues' type='NEW' prio='LOW' status="CLOSED">
   <topic>The InvocationRecorder should allow to record the return values of method invocations as well</topic>
   <description>
      The current approach has the following drawback:
      The return values of the calls are lost.
      As soon as someone needs this, she should hack and extend
      the framework.
   </description>
   <author>ruff@swand.lake.de</author>
   <date>2000 02 24</date>
   <revision>$Revision: 1.3 $</revision>
   <testcase status="OPEN">
      <name></name>
      <comment>
      </comment>
      <test tool="SUITE"></test>
   </testcase>
</requirement>

